{
  "sprig_tree": 1,
  "syntax": {
    "title": "Keys",
    "root": {
      "line": 1,
      "span": [0, 4],
      "text": "Keys",
      "children": [
        {
          "line": 3,
          "span": [6, 59],
          "mark": "-",
          "text": "Renew",
          "fields": {
            "renew": "2026-10-02",
            "due": "2026-10-05",
            "starts": "fri"
          }
        }
      ]
    }
  },
  "resolved": {
    "file": "main.sprig",
    "line": 1,
    "label": "Keys",
    "status": "todo",
    "progress": {
      "done": 0,
      "doing": 0,
      "total": 1
    },
    "children": [
      {
        "file": "main.sprig",
        "line": 3,
        "mark": "-",
        "label": "Renew",
        "status": "todo",
        "progress": {
          "done": 0,
          "doing": 0,
          "total": 1
        },
        "due": "2026-10-05"
      }
    ]
  },
  "diagnostics": []
}
